{
  "type": "https://insight.example/problems/auth-denial",
  "title": "Authentication required",
  "status": 401,
  "detail": "Valid authentication is required.",
  "instance": "/requests/22222222-2222-4222-8222-222222222222",
  "code": "AUTHENTICATION_REQUIRED",
  "requestId": "22222222-2222-4222-8222-222222222222",
  "correlationId": "33333333-3333-4333-8333-333333333333"
}
